Ph-id,C-id,Local_lat,Local_long,Region,Division,Subregion,Area/Kingdom,Culture,Culture_loc,Ph_cid,Audio_notes,Duration,Audio_file,Archival_source#,Song,Genre,Song_notes,Performers,Instruments,Lyrics,Living_metadata,Recorded_by,Year,Publisher,Publcation_collection,Repository,Classification_notes,Metadata_notes,Sources,Source Tag
269,,-39.23,175.6,Oceania,New Zealand,New Zealand,North Island,Maori,"North Island, New Zealand",20835,,0:01:04,,3A22.B2,Karakia to Tanemahuta,Karakia; Incantation,"This is a karakia, or incantation, supplicating the god of the forests, Tanemahuta, to give up one of his ""children"" for the use of man. When it is decided to fell a tree in the forest this karakia is chanted, and it especially applies if the tree is to become a canoe or a ridge-pole for a building. The chant is recited by the selected tree and when ended the chopping commences.",Male solo,Male Voice,,,Alain Daniélou,1950,Smithsonian Folkways,"Maori Songs of New Zealand. Folkways Records FE4433, 1952","Ralph Rinzler Folklife Archives and Collections, Smithsonian Center for Folklife and Cultural Heritage. http://www.folklife.si.edu/archive; Copy in Alan Lomax Collection, American Folklife Center, Library of Congress",,,https://folkways.si.edu/karakia-to-tanemahuta/world/music/track/smithsonian,@FW1952MaoriSongs
272,,-39.23,175.6,Oceania,New Zealand,New Zealand,North Island,Maori,"North Island, New Zealand",20835,,0:00:51,,3A22.B4,He Whakaaraara (Ancient Sentinal Alarm),Sentilnal alarm,This alarm was uttered by a guard when on sentinel duty. He was expected to give the alarm or warning when the enemy was seen approaching the village. In times of peace this alarm would be used at daybreak as a means of awakening the fort.,Male solo,Male Voice,,,Alain Daniélou,1950,Smithsonian Folkways,"Maori Songs of New Zealand. Folkways Records FE4433, 1952","Ralph Rinzler Folklife Archives and Collections, Smithsonian Center for Folklife and Cultural Heritage. http://www.folklife.si.edu/archive; Copy in Alan Lomax Collection, American Folklife Center, Library of Congress",,,https://folkways.si.edu/he-whakaaraara-ancient-sentinal-alarm/world/music/track/smithsonian,@FW1952MaoriSongs
273,,-39.23,175.6,Oceania,New Zealand,New Zealand,North Island,Maori,"North Island, New Zealand",20835,,0:03:26,,3A22.A3,Tangi: Lament by Te Paraona,Tangi; Lament; victory song; historical song,"This lament, a classic of the Tuhoe tribe, was composed by Te Paraona in memory of a warrior chieftain who was murdered in the period prior to the Treaty of Waitangi in 1840. This tangi recalls victories over the neighboring tribes during preceding centuries.",Male leader; male chorus,Male Voices,,,Alain Daniélou,1950,Smithsonian Folkways,"Maori Songs of New Zealand. Folkways Records FE4433, 1952","Ralph Rinzler Folklife Archives and Collections, Smithsonian Center for Folklife and Cultural Heritage. http://www.folklife.si.edu/archive; Copy in Alan Lomax Collection, American Folklife Center, Library of Congress",,,https://folkways.si.edu/tangi-lament-by-te-paraona/world/music/track/smithsonian,@FW1952MaoriSongs
274,,-39.23,175.6,Oceania,New Zealand,New Zealand,North Island,Maori,"North Island, New Zealand",20835,,0:02:29,,3A22.B7,Apakura (dirge),Lament; dirge; funeral song,"This is a lament of the Tuhoe tribe, and it is chanted either during the lying-in-state of a body or at the actual funeral ceremony. Makes reference to the existence of a god known to the ancient Maori as Io Matua Te Kore.",Male solo,Male Voice,,,Alain Daniélou,1950,Smithsonian Folkways,"Maori Songs of New Zealand. Folkways Records FE4433, 1952","Ralph Rinzler Folklife Archives and Collections, Smithsonian Center for Folklife and Cultural Heritage. http://www.folklife.si.edu/archive; Copy in Alan Lomax Collection, American Folklife Center, Library of Congress",,,https://folkways.si.edu/apakura-dirge/world/music/track/smithsonian,@FW1952MaoriSongs
276,,-39.23,175.6,Oceania,New Zealand,New Zealand,North Island,Maori,"North Island, New Zealand",20835,,0:00:56,,3A22.B3,Karakia to Tangaroa,Karakia; Incantation,"This particular incantation belongs to the Te Arawa people. It was uttered by the high-priest Ngatoroirangi when the canoe of Te Arawa was on the verge of being engulfed by a whirlpool in mid-Pacific centuries ago. Ngatoroirangi prayed to Tangaroa, the god of hte oceans, to free the canoe. This incident is known as ""Te korokoro o te parata.""",Male solo,Male Voice,,,Alain Daniélou,1950,Smithsonian Folkways,"Maori Songs of New Zealand. Folkways Records FE4433, 1952","Ralph Rinzler Folklife Archives and Collections, Smithsonian Center for Folklife and Cultural Heritage. http://www.folklife.si.edu/archive; Copy in Alan Lomax Collection, American Folklife Center, Library of Congress",,,https://folkways.si.edu/karakia-to-tangaroa/world/music/track/smithsonian,@FW1952MaoriSongs
136,169,36.06,-109.18,North America,United States,Southwest US,Arizona/ Utah/ New Mexico,Diné (Navaho),"Navajo Nation, U.S.",22243,,0:01:18,PENDING,1B2.B1,Night Chant,Initiation Rite; Chant; Night Song; Boys' Song; Girls' Song,"Navajo boys and girls initiation ceremony, male soloist in falsetto with shaker","Male solo, shaker",Male Voice; Shaker,,,Willard Rhodes,1940-50,Smithsonian Folkways,"Music of the American Indians of the Southwest. Ethnic Folkways Library FE 4420, 1951","Ralph Rinzler Folklife Archives and Collections, Smithsonian Center for Folklife and Cultural Heritage. http://www.folklife.si.edu/archive; Copy in Alan Lomax Collection, American Folklife Center, Library of Congress",,T5405R85,http://www.folkways.si.edu/TrackDetails.aspx?itemid=11314; Recordings of indigenous North Americans will not be published on this site without permission from tribal representatives.,@FW1951MusicOfAmericanIndiansSouthwest
135,170,36.99,-109.04,North America,United States,Southwest US,Arizona/ Utah/ New Mexico,Diné (Navaho),"Four Corners, Arizona /New Mexico",22243,,0:01:21,PENDING,1B2.B2; WFS3.9,Enemy Way,War Dance Song; Dance Song; Chant,"War dance, purification chant for those defiled by the enemy or who have come in contact with non-Navajos","Male leader, male chorus, drum",Male Voice; Male Voices; Drum,,,Willard Rhodes,1940-50,Smithsonian Folkways,"Music of the American Indians of the Southwest. Ethnic Folkways Library FE 4420, 1951","Ralph Rinzler Folklife Archives and Collections, Smithsonian Center for Folklife and Cultural Heritage. http://www.folklife.si.edu/archive; Copy in Alan Lomax Collection, American Folklife Center, Library of Congress",,T5405R86,http://www.folkways.si.edu/TrackDetails.aspx?itemid=11315; Recordings of indigenous North Americans will not be published on this site without permission from tribal representatives.,@FW1951MusicOfAmericanIndiansSouthwest
133,903,36.99,-109.04,North America,United States,Southwest US,Arizona/ Utah/ New Mexico,Diné (Navaho),"Four Corners, Arizona /New Mexico",22243,,0:01:03,PENDING,"1B1.B6,2",Social Dance Song,Social Dance; Dance Song; Healing Song,"Social dance, formerly ""squaw"", preferred term Nidaa' or Enemy Way Ceremony, rare occasion of mixed gender dancing, originally conducted for soldiers in foreign wars, it is a healing ceremony that lasts nearly a week",Male chorus,Male Voices,,,David P. McAllester; Donald N. Brown,1961,The Taylor Museum,"Music of the Pueblos, Apache, and Navaho. The Taylor Museum KCMS1204, 1961","Center for Southwest Studies, Fort Lewis College, Durango, Colorado; Copy in Alan Lomax Collection, American Folklife Center, Library of Congress",,T5405R88,Recordings of indigenous North Americans will not be published on this site without permission from tribal representatives.,@TM1961MusicOfThePueblosApacheNavaho
134,1517,36.99,-109.04,North America,United States,Southwest US,Arizona/ Utah/ New Mexico,Diné (Navaho),"Four Corners, Arizona /New Mexico",22243,,0:01:14,PENDING,1B21.B2,Song of Happiness,,Sung by women to sustain the morale of Navajo men confined at Fort Sumner,Fort Wingate Indian School's children's chorus,Children's Voices,,,Willard Rhodes,1949,Smithsonian Folkways,"Music of the Sioux and the Navajo. Ethnic Folkways Library FE 4401, 1953","Ralph Rinzler Folklife Archives and Collections, Smithsonian Center for Folklife and Cultural Heritage. http://www.folklife.si.edu/archive; Copy in Alan Lomax Collection, American Folklife Center, Library of Congress",,T5405R93,http://www.folkways.si.edu/TrackDetails.aspx?itemid=13031; Recordings of indigenous North Americans will not be published on this site without permission from tribal representatives.,@FW1949MusicOfTheSiouxAndNavajo
129,,36.99,-109.04,North America,United States,Southwest US,Arizona/ Utah/ New Mexico,Diné (Navaho),"Four Corners, Arizona /New Mexico",22243,,,,1B1.B7,Yeibichai Song,Dance song; Ceremonial song; Healing song; Initiation rite,The Yeii bichai (Granduncles of the Gods) are masked dancers who perform in the Nightway and other ceremonials. They come to lend their presence and power to the healing and initiation that take place in this rite.,Male solo,Male Voice,,,David P. McAllester; Donald N. Brown,1955,The Taylor Museum,"Music of the Pueblos, Apache, and Navaho. The Taylor Museum KCMS1204, 1961","Center for Southwest Studies, Fort Lewis College, Durango, Colorado; Copy in Alan Lomax Collection, American Folklife Center, Library of Congress",,"Coding sheet says both ""Yebichai song"" and ""Sway song"" which are two different categories of song. Based on the track number, I believe Yebichai song is correct.",Recordings of indigenous North Americans will not be published on this site without permission from tribal representatives.,@TM1961MusicOfThePueblosApacheNavaho
131,,36.99,-109.04,North America,United States,Southwest US,Arizona/ Utah/ New Mexico,Diné (Navaho),"Four Corners, Arizona /New Mexico",22243,,0:01:39,,1B3.B2; 1B21.B6,Squaw Dance,Dance song,"The Squaw Dance was once an incidental element of the War Ceremony, a chant whose function was the purification of those who had been defiled by contact with the enemy. Today the ceremonial is used as a curative chant for those whose sickness is believed to result from contact with non-Navajos, and the Squaw Dance has become the chief attraction.","Male chorus, drum",Male Voices; Drum,,,Willard Rhodes,1949,Smithsonian Folkways,"American Indian Dances. Ethnic Folkways Library FE 6510, 1958","Ralph Rinzler Folklife Archives and Collections, Smithsonian Center for Folklife and Cultural Heritage. http://www.folklife.si.edu/archive; Copy in Alan Lomax Collection, American Folklife Center, Library of Congress",,,https://folkways.si.edu/squaw-dance-navaho/american-indian/music/track/smithsonian,@FW1958AmericanIndianDances
137,,36.99,-109.04,North America,United States,Southwest US,Arizona/ Utah/ New Mexico,Diné (Navaho),"Four Corners, Arizona /New Mexico",22243,,0:02:55,,1B3.A1; 1B21.B8,"Night Chant, Yeibichai",Ceremonial song; Initiation rite; Dance song,"The Night Chant, popularly known as the Yeibichai (Grandfather of the Gods) is an important nine day ceremony which may not be performed until after the first killing frost. It is at this ceremony that boys and girls are initiated into the ceremonial life of the tribe by two masked dancers who impersonate the Grandfathers of the Monsters and Female Divinity. On the last night of the ceremony which is open to the public, Yeibichai appears with a company of masked gods and dances. After a wierd, unearthly call of the gods, the dancers shake their rattles with a sweeping movement from the ground to their heads, then whirl to the opposite direction and repeat the rattling. Following this formalized introduction, the dancers begin their rhythmic dance and song, accompanying themselves with the rattles","Male chorus, gourd rattles",Male Voices; Gourd Rattles,,,Willard Rhodes,1949,Smithsonian Folkways,"American Indian Dances. Ethnic Folkways Library FE 6510, 1958","Ralph Rinzler Folklife Archives and Collections, Smithsonian Center for Folklife and Cultural Heritage. http://www.folklife.si.edu/archive; Copy in Alan Lomax Collection, American Folklife Center, Library of Congress",,,https://folkways.si.edu/night-chant-yeibichai/american-indian/music/track/smithsonian,@FW1958AmericanIndianDances
130,,36.42,-109.24,North America,United States,Southwest US,Arizona/ Utah/ New Mexico,Diné (Navaho),"Lukachukai, AZ",22243,,0:03:42,,1B10.A3,Squaw Dance,Curing song; Social Dance song; Ceremonial song,"Three-day summertime curing ceremony and social dance. The only dance in which couples dance together. The girl approaches the man, grasps him firmly by the arm or the belt, and pulls him into the circle of dancers. He must dance with her until he pays, and pays well.","Male chorus, drum",Male Voices; Drum,,,Laura Boulton,1941,Smithsonian Folkways,"Indian Music of the Southwest. Folkways Records FW8850, 1957","Ralph Rinzler Folklife Archives and Collections, Smithsonian Center for Folklife and Cultural Heritage. http://www.folklife.si.edu/archive; Copy in Alan Lomax Collection, American Folklife Center, Library of Congress; All rights held by Columbia University",,,https://folkways.si.edu/navajo-squaw-dance/american-indian/music/track/smithsonian,@FW1957IndianMusicOfTheSouthwest
138,,36.42,-109.24,North America,United States,Southwest US,Arizona/ Utah/ New Mexico,Diné (Navaho),"Lukachukai, AZ",22243,,0:03:37,,1B10.A4,"Night Chant, Yeibichei",Ceremonial song; Initiation rite; Dance song,"The Night Chant (called Yebitchai after the principal figure, the maternal grandfather of the gods) is perhaps the most sacred ceremony of all the Navajo chants for in it the gods and goddesses appear in masks (made of sacred buckskin) and assist in the ritual. After the initial eerie calls of the god, ""Hu-tu-tu-tu,"" the dancers shake their rattles with a sweeping motion from the ground to their heads, then whirl to the opposite direction and repeat the rattling. To the accompaniment of the rattles the gods begin to dance, stamping the ground vigorously with their right feet and singing a wild, rhythmic chant.","Male chorus, rattles",Male Voices; Rattles,,,Laura Boulton,1941,Smithsonian Folkways,"Indian Music of the Southwest. Folkways Records FW8850, 1957","Ralph Rinzler Folklife Archives and Collections, Smithsonian Center for Folklife and Cultural Heritage. http://www.folklife.si.edu/archive; Copy in Alan Lomax Collection, American Folklife Center, Library of Congress; All rights held by Columbia University",,,https://folkways.si.edu/navajo-night-chant-yeibichei/american-indian/music/track/smithsonian,@FW1957IndianMusicOfTheSouthwest
132,,,,North America,United States,Southwest US,Arizona/ Utah/ New Mexico,Diné (Navaho),,22243,,,,,,,,,,,,,,,,,,Coding sheet missing,,
4,474,33.91,-90.49,North America,United States,Southeast US,Mississippi Delta,MS Delta Black,"MS State Penitentiary, Parchman, MS",24619,Old audio file #T5521R37 ,0:03:11,T5623R11,5A65.B1,Rosie,Work Song; Prison Song,"Rosie was the big song of the MS Penitentiary, Rosie is the faithful-unfaithful girl of the prisoner's fantasy, constant in one verse, false in the next, as one tormenting notion after another arrives in the singer's mind. 

The Lomaxes and others recorded numerous versions of this archetypal Mississippi prison song. “Rosie” was a generic name for a woman at Parchman Farm Penitentiary, and turns up in other prison songs recorded there. Nina Simone used the melody of “Rosie” for her 1965 recording of “Be My Husband”. A version by Leadbelly was adapted with new words by The Animals and retitled “Inside Looking Out.” It appeared as the B-side to The Animals’ eighth single, the first for Decca in 1966, and was produced by Tom Wilson after the band’s split from Mickie Most and EMI. Grand Funk Railroad also has had many versions of “Inside Looking Out” appear on both studio and live albums (Live Album (1970), Caught In The Act (1975), Live: The 1971 Tour). (Hear more Lomax prison songs on Prison Songs Volume 1: Murderous Home and Prison Songs Volume 2: Don’tcha Hear Poor Mother Calling? on Rounder’s Alan Lomax Collection album series, Rounder 1714 and 1715).","C.B. '88' Cooke, ten men, axes",Male Voice; 10 Male Voices; Axes,,,Alan Lomax,1947,Tradition Records,"Prison Recordings, ACE Online Archive","Alan Lomax Collection, American Folklife Center, Library of Congress",,,"Prev. published as Negro Prison Songs. Tradition Records, TLP1020, 1957",@Tradition1958NegroPrisonSongs
30,475,33.91,-90.49,North America,United States,Southeast US,Mississippi Delta,MS Delta Black,"Mississippi State Penitentiary, Parchman, MS",24619,Old audio file #T476,0:02:58,T5619R13,5A65.B2,Levee Camp Holler,Holler: Levee Camp Holler,Sung while raising the levees in the Mississippi Valley,W.D. 'Bama' Stewart,Male Voice,,,Alan Lomax,1947,ACE Online Archive 2012,"Prison Recordings, ACE Online Archive","Alan Lomax Collection, American Folklife Center, Library of Congress",,,,@ALA1947LeveeCampHoller
8,,33.98,-91.56,North America,United States,Southeast US,Mississippi Delta,MS Delta Black,"Gould, AR",24619,,0:02:29,,6L4.A3,Joe the Grinder,Levee Holler; Prison Song,,Irvin Lowry,Male voice,"1. O Lord, a tew days longer, now, man. 
2. They call me Joe the Grinder, O baby.
3. When I roll my long time down, I'm goin'' home. ",,John A. Lomax,1939,Library of Congress,"Afro-American Blues and Game Songs. Library of Congress, AAFS L4, 1942","Alan Lomax Collection, American Folklife Center, Library of Congress",,,,@AAFS1942AfroAmericanBluesGameSongs
16,,33.98,-91.56,North America,United States,Southeast US,Mississippi Delta,MS Delta Black,"Gould, AR",24619,,0:02:59,,6L3.B6,John Henry,Ballad; Historical song; Railroad song,"John Henry is an African American folk hero. He is said to have worked as a ""steel-driving man""—a man tasked with hammering a steel drill into rock to make holes for explosives to blast the rock in constructing a railroad tunnel. According to legend, John Henry's prowess as a steel-driver was measured in a race against a steam-powered rock drilling machine, a race that he won only to die in victory with hammer in hand as his heart gave out from stress. John Henry is arguably the most popular American folk song.",Arthur Bell,Male Voice,"1. 	Well, every Monday mornin',
When the bluebirds begin to sing,
You can hear those hammers a mile or more,
You can hear John Henry's hammer ring, 0 Lordy!
Hear John Henry's hammer ring.
2. 	John Henry told his old lady,
""Will you fix my supper soon ?
Got ninety miles 0 ' track I've got to line,
Got to line it by the light of the moon, 0 Lordy!
Line it by the light o' the moon.""
3. 	John Henry had a little baby,
He cou1d hold him out in his hand;
WeH, the last word I heard that po' child say,
""My daddy is a steel-drlvin' man, 0 Lordy!
Daddy is a steel-drivin' man.""
4. 	John Henry told his old captain,
Said, ""A,man ain't nothio' but a man ;
Before I let your steel gang down
I will die with the hammer in my band, 0 Lordy !
Die with the hammer in my hand.""
5. 	John Henry told his captain,
""Next time you go to town
Ub-jes' bring me back a ten-pound maul
F or to beat your steel-drivin' down, 0 Lordy!
Beat your steel-drivin' down."" 
6. 	John Henry had a old lady,
And ber name was Polly Ann.
John Henry tuck sick and he had to go to bed;
Pauline drove steel like a man, 0 Lordy !
'Line drove steelllke a man.
7. 	John Henry had a old lady,
And the dress she wo' was red.
Well, she started up the track and she never looked back,
""Goin' where my man fell dead, 0 Lordy !
Where my man fell dead.""
8. 	Well, they taken John Henry to WaShington,
And they buried him in the sand.
There is peoples from the East, there's peoples fl'om the West
Come to see sueh a steel-drivin' man, 0 Lordy!
See such a steel-drivin' man.
9. 	'VeIl, some said-uh he's from England,
And some say be's from Spain;
But·ull I say he's noth10' but a Lou's'ana mao,
Just a leader of the steel-drivio' gnng, 0 Lordy,
I...eader of the steeI-drivin' gang. ",,John A. and Ruby T. Lomax,1939,Library of Congress,"Afro-American Spirituals, Work Songs, and Ballads AFS L3","Alan Lomax Collection, American Folklife Center, Library of Congress",,,,@AFS1942AfroAmericanSpiritualsWorkSongsBallads
25,,34.87,-89.69,North America,United States,Southeast US,Mississippi Delta,MS Delta Black,"Byhalia, MS",24619,,0:00:41,,6L4.B6,Old Uncle Rabbit,Game song; Children's song,,Katherine and Christine Shipp,Female Voices,"1. L: If I live,
C: Chool-dy, chool-dy
L: To see nex' fall,
C: Chool-dy, chool-dy
L: I ain' gon' raise,
C: Chool-dy, chool-dy
L: No cabbage at all,
C: Chool-dy, chool-dy

2. L: Ol' Uncle Rabbit,
Got a habit,
In my garden,
Eatin' all my cabbage.

3. An' if I live
To see nex' fall
I ain' gon' raise
No cabbage at all.",,Herbert Halpert,1939,Library of Congress,"Afro-American Blues and Game Songs. Library of Congress, AAFS L4, 1942","Alan Lomax Collection, American Folklife Center, Library of Congress",,,,@AAFS1942AfroAmericanBluesGameSongs
1,,33.4,-91.05,North America,United States,Southeast US,Mississippi Delta,MS Delta Black,"Greenville, MS",24619,,0:00:50,,6L8.A4,Mississippi Sounding Call 1,Work song; Sounding call,"The soundings are called by the leadsman to a deckhand (the word passer) on the hurricane deck, who relays them to the pilot. ""Quarter less twain"" means two fathoms less a quarter, or 10.5 feet. Similarily, ""quarter less four"" is 22.5 feet, and ""quarter less five"" is 28.5 feet. ""Half twain"" is 2.5 fathoms or 15 feet.  Joe Shores, fifty-two years old, uses ""newer"" calls. At the time of this recording, he was pilot on the night run of the A. C. Jaynes, a ferryboat plying between Greenville, Mississippi, and Arkansas City, Arkansas.",Joe Shores,Male voice,"No bottom,
Mark four,
Quarter less four,
Quarter less five,
Half twain,
Quarter twain.",,Herbert Halpert,1939,Library of Congress,"Negro Work Songs and Calls. Library of Congress, AFS L8, 1943","Alan Lomax Collection, American Folklife Center, Library of Congress",,,,@AFS1943NegroWorkSongsAndCalls
23,,33.4,-91.05,North America,United States,Southeast US,Mississippi Delta,MS Delta Black,"Greenville, MS",24619,,0:01:08,,6L8.A5,Mississippi Sounding Call 2,Work song; Sounding call,"The soundings are called by the leadsman to a deckhand (the word passer) on the hurricane deck, who relays them to the pilot. ""Quarter less twain"" means two fathoms less a quarter, or 10.5 feet. Similarily, ""quarter less four"" is 22.5 feet, and ""quarter less five"" is 28.5 feet. ""Half twain"" is 2.5 fathoms or 15 feet.  Joe Shores, fifty-two years old, uses ""newer"" calls. At the time of this recording, he was pilot on the night run of the A. C. Jaynes, a ferryboat plying between Greenville, Mississippi, and Arkansas City, Arkansas.",Joe Shores,Male voice,"Quarter less four,
Half twain,
Quarter twain, 
Mark twain, 
Quarter less twain, 
Nine and a half feet, 
Nine feet, 
Eight and a half feet. ",,Herbert Halpert,1939,Library of Congress,"Negro Work Songs and Calls. Library of Congress, AFS L8, 1943","Alan Lomax Collection, American Folklife Center, Library of Congress",,,,@AFS1943NegroWorkSongsAndCalls
35,,33.91,-90.49,North America,United States,Southeast US,Mississippi Delta,MS Delta Black,"Mississippi State Penitentiary, Parchman, MS",24619,,0:02:09,T796R04,5A65.A2,"No More, My Lawd",Prison song; Spiritual; Work song,,"Henry ""Jimpson"" Wallace",Male Voice; axe,,,Alan Lomax,1948,ACE Online Archive 2012,"Prison Recordings, ACE Online Archive","Alan Lomax Collection, American Folklife Center, Library of Congress",,,,@ALA1948NoMoreMyLawd
36,,33.91,-90.49,North America,United States,Southeast US,Mississippi Delta,MS Delta Black,"Mississippi State Penitentiary, Parchman, MS",24619,,0:02:40,"T800R01
",5A65.A9,It Makes A Long Time Man Feel Bad,Prison song; Work song,,"Benny Will Richardson, unidentified prisoners",Male Voices; hoe,,,Alan Lomax,1947,ACE Online Archive 2012,"Prison Recordings, ACE Online Archive","Alan Lomax Collection, American Folklife Center, Library of Congress",,"Coding sheet lists this song by name, but lists it as a male solo and as side A track 6, which corresponds to a different song.",,@ALA1947ItMakesALongTimeManFeelBad
37,,33.91,-90.49,North America,United States,Southeast US,Mississippi Delta,MS Delta Black,"Mississippi State Penitentiary, Parchman, MS",24619,,0:04:05,T803R02,5A65.B7,Stackerlee,Ballad; Blues; Holler,,W.D. 'Bama' Stewart,Male Voice,,,Alan Lomax,1947,ACE Online Archive 2012,"Prison Recordings, ACE Online Archive","Alan Lomax Collection, American Folklife Center, Library of Congress",,,,@ALA1947Stackerlee
40,,33.91,-90.49,North America,United States,Southeast US,Mississippi Delta,MS Delta Black,"Mississippi State Penitentiary, Parchman, MS",24619,,0:01:11,,6L4.A1,I Don't Mind The Weather,Prison song; Holler,,Jim Henry,Male Voice,"1.         Mmmm---
Boys, I've got a boychIld In Texas, he ought to be 'bout grown.

2. O------
Go marchin' to the table, O Lord, lind the same old thIng.

3. Ummm--, 
Boys, I'll be so glad when payday comes. 
O-----
captain, captain, when payday comes. 

I'm gonna catch that Illinois Central, 0 Lord, goin' to Kankakee. 
Mmmm------.",,John A. Lomax,1937,Library of Congress,"Afro-American Blues and Game Songs. Library of Congress, AAFS L4, 1942","Alan Lomax Collection, American Folklife Center, Library of Congress",,,,@AAFS1942AfroAmericanBluesGameSongs
